{"classes":{"Organization":{"ancestors":["Organization"],"fixed_predicate":null,"id_format":"linkml","id_policy":"require","is_a":null,"label_slot":"name","name":"Organization","origin_key_slots":[],"qualifier_slots":[],"relations":[],"role":"node","search_slots":["name"],"slots":{"created_at":{"duckdb_type":"TIMESTAMP","enum":null,"external_identifier":null,"identifier":false,"maximum_value":null,"meaning":null,"minimum_value":null,"multivalued":false,"name":"created_at","object_reference":false,"ordered":false,"pattern":null,"range":"datetime","required":false,"search_weight":null,"sensitive":false,"view_column":"created_at"},"id":{"duckdb_type":"VARCHAR","enum":null,"external_identifier":null,"identifier":true,"maximum_value":null,"meaning":"sdo:identifier","minimum_value":null,"multivalued":false,"name":"id","object_reference":false,"ordered":false,"pattern":null,"range":"string","required":true,"search_weight":null,"sensitive":false,"view_column":"id"},"name":{"duckdb_type":"VARCHAR","enum":null,"external_identifier":null,"identifier":false,"maximum_value":null,"meaning":"sdo:name","minimum_value":null,"multivalued":false,"name":"name","object_reference":false,"ordered":false,"pattern":null,"range":"string","required":true,"search_weight":null,"sensitive":false,"view_column":"name"},"updated_at":{"duckdb_type":"TIMESTAMP","enum":null,"external_identifier":null,"identifier":false,"maximum_value":null,"meaning":null,"minimum_value":null,"multivalued":false,"name":"updated_at","object_reference":false,"ordered":false,"pattern":null,"range":"datetime","required":false,"search_weight":null,"sensitive":false,"view_column":"updated_at"}},"statement_shape":null,"type_uri":"https://schema.org/Organization","view":"organization"},"Person":{"ancestors":["Person"],"fixed_predicate":null,"id_format":"linkml","id_policy":"require","is_a":null,"label_slot":"full_name","name":"Person","origin_key_slots":[],"qualifier_slots":[],"relations":["Person.aliases","Person.employed_by"],"role":"node","search_slots":["full_name"],"slots":{"age":{"duckdb_type":"BIGINT","enum":null,"external_identifier":null,"identifier":false,"maximum_value":null,"meaning":null,"minimum_value":0,"multivalued":false,"name":"age","object_reference":false,"ordered":false,"pattern":null,"range":"integer","required":false,"search_weight":null,"sensitive":false,"view_column":"age"},"aliases":{"duckdb_type":"VARCHAR","enum":null,"external_identifier":null,"identifier":false,"maximum_value":null,"meaning":"sdo:alternateName","minimum_value":null,"multivalued":true,"name":"aliases","object_reference":false,"ordered":false,"pattern":null,"range":"string","required":false,"search_weight":null,"sensitive":false,"view_column":null},"created_at":{"duckdb_type":"TIMESTAMP","enum":null,"external_identifier":null,"identifier":false,"maximum_value":null,"meaning":null,"minimum_value":null,"multivalued":false,"name":"created_at","object_reference":false,"ordered":false,"pattern":null,"range":"datetime","required":false,"search_weight":null,"sensitive":false,"view_column":"created_at"},"employed_by":{"duckdb_type":"VARCHAR","enum":null,"external_identifier":null,"identifier":false,"maximum_value":null,"meaning":"sdo:worksFor","minimum_value":null,"multivalued":true,"name":"employed_by","object_reference":true,"ordered":false,"pattern":null,"range":"Organization","required":false,"search_weight":null,"sensitive":false,"view_column":null},"full_name":{"duckdb_type":"VARCHAR","enum":null,"external_identifier":null,"identifier":false,"maximum_value":null,"meaning":"sdo:name","minimum_value":null,"multivalued":false,"name":"full_name","object_reference":false,"ordered":false,"pattern":null,"range":"string","required":true,"search_weight":null,"sensitive":false,"view_column":"full_name"},"id":{"duckdb_type":"VARCHAR","enum":null,"external_identifier":null,"identifier":true,"maximum_value":null,"meaning":"sdo:identifier","minimum_value":null,"multivalued":false,"name":"id","object_reference":false,"ordered":false,"pattern":null,"range":"string","required":true,"search_weight":null,"sensitive":false,"view_column":"id"},"updated_at":{"duckdb_type":"TIMESTAMP","enum":null,"external_identifier":null,"identifier":false,"maximum_value":null,"meaning":null,"minimum_value":null,"multivalued":false,"name":"updated_at","object_reference":false,"ordered":false,"pattern":null,"range":"datetime","required":false,"search_weight":null,"sensitive":false,"view_column":"updated_at"}},"statement_shape":null,"type_uri":"https://schema.org/Person","view":"person"}},"compiler":{"linkml_runtime_version":"1.11.1","name":"graft-linkml-compiler","python_version":"3.10.19","script_digest":"sha256:2720893b91978930cbdf3f99feadf9bd96822fdf8ece018c7711af9914f42a7d","version":"0.3.0"},"enums":{},"fingerprints":{"build_digest":"sha256:85edd6938accaeb1e7afce0792b1fedd0764ad0916cfb361e97a75e69cc223b7","source_digest":"sha256:2148a731974a68e5e05cedc0fbe2b1bfa0b46c247139c85caf737736a044fb24","structural_digest":"sha256:7d18548b30b6da74a443cb5adc7a8165d7f0f7a639ab7db9df7fb2d619d46fbc"},"graph_projections":{"node_classes":["Organization","Person"],"provenance_edges":{"evidence_to_source":true,"mention_resolution":true,"narrative_slots":["about","primary_subject"],"narrative_statement_classes":[],"semantic_derivation":true,"statement_to_evidence":true,"supersession":true},"semantic_edges":{"direct_edge_classes":[],"exclude_narrative_statements":true,"object_relations":["Person.employed_by"],"semantic_statement_classes":[]}},"identifier_normalization_versions":{},"manifest_version":"2.0.0","projection_mapping_version":"1","relations":[{"kind":"value","name":"Person.aliases","ordered":false,"owner_class":"Person","owner_view":"person","predicate":"https://schema.org/alternateName","slot":"aliases","view":"person__aliases"},{"kind":"object","name":"Person.employed_by","ordered":false,"owner_class":"Person","owner_view":"person","predicate":"https://schema.org/worksFor","slot":"employed_by","view":"person__employed_by"}],"schema":{"id":"https://w3id.org/graft/examples/personinfo","name":"personinfo","source_files":[{"content_digest":"sha256:8a654f06d4742f95bb1e288bf9bf47c98a8ac1859072787cefc6bea48892d184","name":"personinfo","root":true,"schema_id":"https://w3id.org/graft/examples/personinfo","version":"0.1.0"},{"content_digest":"sha256:1c79b264397bec0eadb404d22e9b163458f1b889809b3b482ecc39c98743fe00","name":"types","root":false,"schema_id":"https://w3id.org/linkml/types","version":null}],"version":"0.1.0"},"slots":{"age":{"duckdb_type":"BIGINT","enum":null,"external_identifier":null,"identifier":false,"maximum_value":null,"meaning":null,"minimum_value":0,"multivalued":false,"name":"age","object_reference":false,"pattern":null,"range":"integer","required":false,"search_weight":null,"sensitive":false},"aliases":{"duckdb_type":"VARCHAR","enum":null,"external_identifier":null,"identifier":false,"maximum_value":null,"meaning":"sdo:alternateName","minimum_value":null,"multivalued":true,"name":"aliases","object_reference":false,"pattern":null,"range":"string","required":false,"search_weight":null,"sensitive":false},"employed_by":{"duckdb_type":"VARCHAR","enum":null,"external_identifier":null,"identifier":false,"maximum_value":null,"meaning":"sdo:worksFor","minimum_value":null,"multivalued":true,"name":"employed_by","object_reference":true,"pattern":null,"range":"Organization","required":false,"search_weight":null,"sensitive":false},"full_name":{"duckdb_type":"VARCHAR","enum":null,"external_identifier":null,"identifier":false,"maximum_value":null,"meaning":"sdo:name","minimum_value":null,"multivalued":false,"name":"full_name","object_reference":false,"pattern":null,"range":"string","required":true,"search_weight":null,"sensitive":false},"id":{"duckdb_type":"VARCHAR","enum":null,"external_identifier":null,"identifier":true,"maximum_value":null,"meaning":"sdo:identifier","minimum_value":null,"multivalued":false,"name":"id","object_reference":false,"pattern":null,"range":"string","required":true,"search_weight":null,"sensitive":false},"name":{"duckdb_type":"VARCHAR","enum":null,"external_identifier":null,"identifier":false,"maximum_value":null,"meaning":"sdo:name","minimum_value":null,"multivalued":false,"name":"name","object_reference":false,"pattern":null,"range":"string","required":true,"search_weight":null,"sensitive":false}},"validation_invariants":[{"applies_to_role":"statement","fields":["confidence"],"maximum":1,"minimum":0,"name":"confidence_bounds","rule":"null_or_between_inclusive"},{"applies_to_role":"statement","fields":["valid_from","valid_to"],"name":"valid_time_order","rule":"null_or_less_than_or_equal"}]}
